{
  "datetime": "2018-10-16T10:14:38.335122-04:00",
  "evtType": "Request",
  "feature": "GA",
  "source": "Excalibur-Web-App",
  "vers": "1.3.13",
  "dest": "ProfileBookings",
  "operation": "GetProfile",
  "method": "POST",
  "context": "vdsId=G7010131",
  "path": "/api/v1/profile/1234",
  "retries": 0,
  "latency": 380,
  "status": 200,
  "success": true,
  "eventId": "56c790bc-a2e1-4eb7-92c2-8129b59bc1c9",
  "traceId": "e4db12f2-b176-432a-a7a6-8bb3ed08beeb",
  "env": "AWS",
  "device": "desktop",
  "platform": "ios",
  "userId": "G7010131",
  "sessionId": "9a0fa33b-e292-46b1-8d34-660d0c35d64f"
}
